"Status","Start Time","Stop Time","Duration in ms","Parent Suite","Suite","Sub Suite","Test Class","Test Method","Name","Description"
"passed","Thu May 28 14:45:45 UTC 2026","Thu May 28 14:45:49 UTC 2026","3297","LMS system","Authentication","Authorization","","","User login with correct email and password",""
"passed","Thu May 28 14:45:50 UTC 2026","Thu May 28 14:45:52 UTC 2026","1501","LMS system","Authentication","Authorization","","","Navigation from login page to registration page",""
"passed","Thu May 28 14:45:45 UTC 2026","Thu May 28 14:45:47 UTC 2026","2032","LMS system","Authentication","Authorization","","","User login with wrong email or password",""
"passed","Thu May 28 14:45:49 UTC 2026","Thu May 28 14:45:51 UTC 2026","1695","LMS system","Authentication","Authorization","","","User login with wrong email or password",""
"passed","Thu May 28 14:45:48 UTC 2026","Thu May 28 14:45:50 UTC 2026","1991","LMS system","Authentication","Authorization","","","User login with wrong email or password",""
